{
  "schema": "echelon.system/v1",
  "id": "vigila",
  "repository": "kemiller2002/vigila",
  "version": "1",
  "executable": "vigila",
  "provides": [
    { "id": "followup.create", "contractVersion": 1 },
    { "id": "followup.update", "contractVersion": 1 },
    { "id": "followup.resolve", "contractVersion": 1 },
    { "id": "followup.query", "contractVersion": 1 }
  ],
  "optionalConsumes": []
}
